name,address,lat,lon,phone
초정힐링캠핑장,충북 청주시 청원구 내수읍 신기초정로 696,36.7196086770306,127.596960793701,0507-1393-8492
솔바비큐 야영장,경기 이천시 경충대로 2900 (사음동),37.2942962938698,127.422278321909,
아리아글램핑,경기 양평군 서종면 노문길96번길 16-42,37.6371344671961,127.421614972324,
별빛담은캠핑,경기 가평군 조종면 명지산로 337-321,37.9071587603962,127.380313954896,0507-1378-2368
다온숲 노을 캠핑정원,경기 파주시 탄현면 새오리로339번길 77-27,37.8159711553968,126.688266329186,0507-1365-3214
화성리프레시글램핑,경기 화성시 서신면 안벼슬길102번길 205,37.1586486565969,126.742919788574,0507-1374-4472
거창산림레포츠파크,경남 거창군 고제면 빼재로 2099-35,35.8591124419584,127.829752746525,
자작 캠핑장,충북 제천시 의병대로 986 (자작동),37.1151040147618,128.292337902853,
밀양캠프밸리 관광농원,경남 밀양시 산내면 얼음골옛길 284-26,35.5766360607856,128.97599898673,0507-1477-8035
강천산 오토캠핑장,전북특별자치도 순창군 팔덕면 강천산길 5,35.4091373668239,127.078048177632,
단양 글램핑&펜션,충북 단양군 단성면 선암계곡로 1080-33,36.8924939667472,128.308237029038,
치악산자연휴양림 야영장,강원특별자치도 원주시 판부면 휴양림길 66,37.2558743720056,128.031373702479,
디뮤어 카라반,강원특별자치도 강릉시 연곡면 부연동길 619,37.8549473043731,128.629199431548,0507-1372-8110
숲202글램핑,경기 포천시 소흘읍 죽엽산로447번길 24-30,37.7915075114241,127.169800772521,
나무와 쉬리,경기 파주시 적성면 율곡로 1571,37.9619854926841,126.861318561977,0507--7658
텐파크캠핑장,강원특별자치도 춘천시 남산면 북한강변길 80,37.83426399379,127.529479256228,
갤럭시엑스 스페이스 캠핑,강원특별자치도 평창군 봉평면 거품소길 269,37.558311283636,128.389581389691,0507-1353-4334
솔모닝캠핑,경기 가평군 상면 수목원로 193-1,37.7612452685805,127.363045761871,
디여라 야영장,경북 안동시 도산면 가송길 134,36.765218199894,128.891469663168,
빨래터캠핑장,경북 고령군 덕곡면 지사동길 95,35.7623305292829,128.247002336156,
힐링캠프,경기 양주시 광적면 쇠장이길 755-64,37.7980674095575,126.917058468105,0507-1312-3002
오시오 캠프,경남 남해군 설천면 강진로 655,34.9378033951294,127.909096143622,
금강호 국민여가 캠핑장,전북특별자치도 군산시 성산면 성덕리 409-1 ,36.0202772651684,126.763564242219,
라온,경북 경주시 천북면 갈곡성지길 174-42,35.8917547443898,129.291147937382,
계수나무 힐링숲,강원특별자치도 춘천시 남면 대곡길 20-69,37.743424360864,127.568355235226,
물멍 캠프,경기 가평군 조종면 명지산로 327-55,37.9006025607285,127.36978736787,
가온휴양빌리지 계곡 글램핑 카라반 캠핑,강원도 홍천군 서면 한서로 1304,37.6432921,127.6200504,033-433-9942
하너미 캠핑장,충북 충주시 앙성면 하너미로 501-3,37.0840605,127.7479529,043-854-0054
황우거주식회사,강원 횡성군 공근면 창봉1길 117,37.5639929,127.9447428,
북한산 사기막야영장,경기 고양시 덕양구 북한산로618번길 130 (효자동),37.6762165,126.9646347,02-388-3301
보령교육가족체험장,충남 보령시 주포면 향교말길 129,36.4091488,126.5981631,
낙화담캠핑장,경북 칠곡군 지천면 지천로 395-70,35.9720178,128.4852755,0507-1472-7032
산아래 글램핑,전남 여수시 율촌면 서부로 1330,34.8365752,127.558209,0507-1428-3430
별빛정원,전북특별자치도 정읍시 하북1길 101 (하북동),35.593164398512,126.854468006116,
원더 포레스트,충북 괴산군 청천면 도경로여사왕2길 4-67,36.7408630607933,127.758761808543,
사천파인트리캠핑장,경남 사천시 축동면 화당산로 10-13,35.096271812248,128.043458681976,070-8828-3214
교래자연휴양림 야영장,제주특별자치도 제주시 조천읍 남조로 2023 ,33.4416045,126.6646731,064-784-7314
안성맞춤 캠핑장,경기 안성시 보개면 남사당로 198-5,37.0343735,127.3088548,031-677-8267
포안캠핑,강원특별자치도 영월군 무릉도원면 두산길 125,37.3120736701298,128.178516353167,010-8674-1426
홍천높은터캠핑장,강원 홍천군 홍천읍 높은터로 235,37.6483474,127.8457640,
해랑해관광농원 캠핑장,충남 태안군 이원면 사관로 264-78,36.8639895,126.3012525,010-9682-2250
진수캠퍼스,경남 양산시 원동면 어곡로 562,35.3580815794812,128.988661656746,
오도치 캠핑장,강원특별자치도 홍천군 서면 오도치길 427,37.6539801322415,127.705664820505,010-2891-5624
호랑이캠핑 한탄강점,경기 포천시 영북면 방골길 507-1,38.0705914435223,127.228256273192,070-4114-3258
정양레포츠공원 오토캠핑장,경남 합천군 대양면 정양리 613,35.5581982,128.1667524,055-933-7729
낙동강 레포츠밸리 강변오토캠핑장,대구광역시 달성군 구지면 오설리 873,35.6727715693727,128.368177221338,053-659-4153
성북동 숲속야영장,대전 유성구 성북로 463 (성북동),36.3151801492719,127.281517146125,042-825-3807
주막거리캠프,경상북도 영주시 부석면 영부로 871 ,37.0398878,128.6684064,010-3540-0470
글램킹 글램핑,전남 함평군 함평읍 장년길 40,35.0941925,126.4768727,
비앙드팜,경기 양평군 강하면 강하1로 380-6,37.4554428,127.3929138,031-8027-6667
파이브이모션,경기 가평군 설악면 자잠로282번길 72-95,37.7000072,127.4999433,
닮다  담다 153,대구 달성군 유가읍 본말리 1010,35.6427432912673,128.481057907537,
은하수 캠핑장,경기 양주시 남면 감악산로514번길 468-8,37.9220570,126.9667082,010-4663-0774
H campi g,강원특별자치도 홍천군 서면 팔봉산로 994,37.6978167919343,127.688796733399,
산오마켓,경기 여주시 금사면 금품1로 468,37.4052299058585,127.48132441545,0507-1437-7767
더쉼 글램핑,전남 고흥군 도덕면 천마로 735,34.5281863033568,127.199400327272,
단밀오토캠핑장,경북 의성군 단밀면 도안로 734,36.3504774149274,128.304921033364,
파주발랑캠핑타운,경기 파주시 광탄면 부흥로 593,37.8063985202741,126.908573503886,1555-5580-
유토피아 오토캠핑장,충청남도 논산시 벌곡면 수락로 669-54 ,36.1964729,127.2919424,041-733-1002
내소힐링캠프,전북특별자치도 부안군 석포리 314-3,35.6101781896942,126.582366271517,
코티지 캠핑,제주특별자치도 서귀포시 안덕면 감산서로 55,33.2584306,126.349892,
보광농촌체험휴양마을,강원 강릉시 성산면 보현길 5,37.7373336,128.8071822,033-641-7890
BE HAPPY,경북 문경시 가은읍 죽문길 206,36.6541198979948,127.99417280342,
내원야영장,경상남도 산청군 삼장면 대포리 산 106-2 ,35.2967767,127.8124104,055-972-7775
골짜구니 캠핑장,강원 양양군 서면 구룡령로 1807,37.9639747,128.5159794,
에코밸리 캠프,경북 경주시 산내면 문복로 506-16,35.6790175,129.0510546,
화장산 캠핑장,울산 울주군 상북면 향산다개로 136-116,35.586111664433,129.118161543926,0507-1315-7839
메이플 포레스트,강원 양양군 현남면 북죽로 110-25,37.9808572,128.7402176,
큰집 관광농원 감성 캠핑,충남 아산시 음봉면 산정길9번길 32,36.8549138705179,127.005421700445,
삼밭골글램핑,경상북도 영천시 삼밭골길 107 ,35.9898702,128.9404502,010-6822-8807
소나무 캠핑장,충북 단양군 가곡면 새밭로 794,36.9889688,128.4548777,010-3061-8329
월성 산아래 글램핑,전라남도 장성군 북하면 월성안길16-33,35.3504375,126.8629648,061-392-6307
케이블카파크랜드 오토캠핑장,경남 통영시 발개로 172-24 (도남동),34.8235945,128.4226330,055-645-2245
더담다 캠핑장,전남 화순군 이양면 람덕길 28-46,34.8520417,127.0497672,061-375-5678
원산도 소록도 (한시) 일반야영장,충청남도 보령시 오천면 원산도리 1860-6 앞 공유수면 ,36.3628195,126.4341187,
가평조이글램핑,경기 가평군 북면 멱골로272번길 9,37.9132053,127.5766743,
초전바다숲야영장,경남 남해군 미조면 동부대로14번길 34,34.72768563018,128.033646773935,
팜데이,충북 제천시 탑안로 291-10 (고암동),37.1569887441054,128.233308992811,0507-1484-9770
코튼 글램핑장,경기 가평군 청평면 북한강로 1929,37.6897802543971,127.388040266308,0507-1346-1603
갈화오토캠핑장,경상남도 남해군 고현면 갈화리 222-5,34.8975078731964,127.840613275216,
몽산포해변캠핑장,충청남도 태안군 남면 신장리 355-63  -64  -84 ,36.6707521559233,126.288545496281,
수푸로 카라반,강원특별자치도 속초시 장성천길 61-25 (장사동),38.2076649345092,128.551117524765,
Lazy Joe,경기 양평군 서종면 거북바위1길 58-17,37.571125076249,127.42201186603,
방산면 송현리 캠핑장,강원특별자치도 양구군 방산면 송현리 1095-28 ,38.2210148116006,127.956256331754,
메리글램핑,인천 옹진군 영흥면 영흥로525번길 63-124,37.2569570436018,126.449991864348,0507-1391-6734
가평 까사 힐 395 캠핑장,경기 가평군 청평면 솥틀로 54-85,37.7645228936267,127.43180728949,
신암저수지 숲속야영장,경기 양주시 남면 감악산로514번길 242,37.9156311624017,126.966273182504,
교룡공원 숲속야영장,전북특별자치도 남원시 산성길 172 (산곡동),35.4280741141655,127.365468366965,0507-1358-6476
죽도캠핑장,경남 통영시 한산면 죽도길 15-9,34.7340317319652,128.532263786168,
네츄럴 밸리,경기 가평군 상면 임초밤안골로 137,37.7570261355815,127.371893878239,
캠핑 도래,경남 밀양시 단장면 도래재로 332,35.5492481351007,128.936058453824,
석양길 518,경남 사천시 용현면 석양길 530,35.0114448439051,128.049283760687,
삼계리주말농원캠핑장,경북 청도군 운문면 신원3길 74,35.676399,129.0067097,
안성허브마을캠핑장,경기 안성시 삼죽면 국사봉로 641-4,37.0645704,127.3589916,031-671-6969
단양팔경투어,충북 단양군 단양읍 단양노동길 492,36.9855790,128.3805148,043-421-7721
집보다 캠핑장,경기도 안성시 양성면 도라지길 29-22,37.7504085,127.5320818,
오름집,제주특별자치도 서귀포시 보목동 보목포로65번길 6 ,33.2404153,126.6081516,
영월계곡 느티별캠핑장,강원도 영월군 김삿갓면 내리계곡로 1106 ,37.1040435,128.6786909,070-4578-9292
캠핑플레이스 포천점 글램핑&바베큐,경기 포천시 내촌면 내촌로183번길 28-7,37.7970616,127.2320417,031-536-8647
배나무꽃 캠핑장,경기 파주시 법원읍 술이홀로1333번길 128,37.8825957,126.8722898,0507-1436-4679
구미 캠핑장,경북 구미시 낙동제방길 200 (양호동),36.1311328,128.3679960,054-480-2184
캄비오 캠핑장,대구 동구 팔공로 1473 (능성동),35.9632584319361,128.737465384836,
남파랑캠핑장&스테이,경남 남해군 창선면 흥선로 1462,34.8468825408395,128.059500070053,0507-1406-9622
팔봉산관광지 야영장,강원도 홍천군 서면 한치골길 1122-48 ,37.7018759,127.6953124,033-430-4281
북한산 캠핑장,서울 은평구 북한산로 232-1 (진관동),37.6517679,126.938478,02-381-3947
숲속애캠핑장,경남 함양군 백전면 함양남서로 2655,35.578704636633,127.62796915911,010-3012-5476
단양 별마루캠핑장,충북 단양군 매포읍 삼곡길 234,37.0743987,128.256395,010-7605-0202
제니캠핑장,강원특별자치도 횡성군 서원면 서원서로 652,37.5092216,127.801307,010-5049-1127
고기팜키즈캠핑장,경북 경주시 대추밭안길 128-36 (조양동),35.7729111,129.284273,070-8866-4040
서천 금빛노을 서울캠핑장,충청남도 서천군 장선리 128-3,36.0455656,126.7189118,
강나루 오토캠핑장,경상남도 함안군 칠서면 이룡리 998,35.3930913,128.5085477,055-586-2510
횡성 온새미로 캠핑장,강원도 횡성군 청일면 봉명로593번길 76-11,37.6699973,128.1256866,010-3479-6688
에제르파크,인천 남동구 만의골로 155 (장수동),37.4570283,126.7719438,010-2286-4858
웰니스 권역 야영장,충남 공주시 우성면 무성산로 296,36.5010715,127.0888462,
봉포레이크 글램핑 오토캠핑장,강원특별자치도 고성군 토성면 봉포5길 32-13,38.2502646,128.5606297,010-8289-2626
남양캠핑장,경기 화성시 남양읍 신남서길71번길 4,37.1908134169778,126.807977462838,
에덴글램핑,경기 가평군 가평읍 북한강변로 154,37.7468279,127.5254273,031-581-0201
별빛오토캠핑장,경기 가평군 설악면 묵안로 219-15,37.6476195,127.5005264,
소노휴 양평,경기 양평군 개군면 신내길7번길 55,37.4692252,127.5325829,010-7901-5572
채송화글램핑,경북 영천시 화북면 천문로 2118,36.1006799,128.9118199,
양지뜰캠핑장,전북 무주군 설천면 보안길 88,35.9076467,127.7680715,0507-1321-0532
솔밭캠핑장,전북 완주군 운주면 운주로 243-68,36.0976057,127.2641852,
송현 캠핑장,경기 여주시 산북면 금품2로 208-73,37.3780190741333,127.446412800898,
에가톳 캐빈,제주특별자치도 서귀포시 안덕면 상창리 147,33.2988968261301,126.374210809075,
고흥만 수변노을공원 오토캠핑장,전남 고흥군 도덕면 고흥만로 1106,34.6475274,127.1970855,1668-1141-
유포리아 캠핑장,강원특별자치도 평창군 봉평면 수림대길 343,37.5277421,128.355005,
당사현대차오션캠프,울산 북구  당사동 378-4,35.5845026,129.4567240,052-291-0805
왕방산 암벽공원 야영장,경기 포천시 신북면 깊이울로 71,37.9238045,127.1753182,0507-1309-3554
하비비캠핑장,충북 충주시 금가면 오미기2길 120-2,36.9979252,127.8853871,043-851-3308
예손농원캠핑장,경기 포천시 영북면 여우고개로 7,38.0618030,127.3273369,031-531-1255
일영무두리캠핑장,경기도 양주시 장흥면 유원지로 176-77 ,37.7005282,126.9471166,031-855-6102
지리산 포레스트 카라반 파크,전남 구례군 토지면 피아골로 567-12,35.2390289,127.589235,
인주캠핑장,충남 아산시 인주면 대음북길 39,36.8531160,126.852476,
오캄캠핑,경기 연천군 신서면 합내로 483-100,38.1616738490787,127.066264116711,0507-1355-5246
남한산성 캠핑장,경기 광주시 남한산성면 남한산성로 144,37.4550879,127.2350577,031-747-9488
조이포레,충남 당진시 신평면 부곡길 11,36.8855557353387,126.748705868042,
광민이네 오토캠핑장,강원특별자치도 고성군 간성읍 탑동길 469,38.3450015541049,128.456771142296,0507-1382-0636
주식회사 헤리티지글램핑,경남 창원시 마산합포구 구산면 안녕로 427,35.1013382274468,128.601982223355,0507-1487-5629
정동진 캠핑파크,강원특별자치도 강릉시 강동면 율곡로 1010-17,37.6816147654059,129.024721173282,0507-1469-9052
에잇시즌즈,강원특별자치도 홍천군 서면 팔봉산로 909-17,37.6903335078303,127.688009953352,0507-1422-9707
모닥모닥,경기 평택시 이화로 266-7 (월곡동),37.017529573643,127.134201161747,0507-1386-8969
산정호수 맑은물캠핑장,경기 포천시 영북면 산정호수로 976,38.0862741947961,127.319633610466,031-531-0801
더 클리프 카라반 캠핑장,경기 포천시 일동면 영일로 234,37.9548720619375,127.256904913684,0507-1347-8696
그루잠,경기 가평군 상면 물골길 175-73,37.8356574672629,127.310011622511,
해뜨고 달뜨고,경북 칠곡군 지천면 용산로 170-72,35.8909090822755,128.503373576319,
캠핑산 야영장,강원특별자치도 횡성군 서원면 양서동로 377,37.4592093887739,127.7976522064,
달너머 캠핑장,강원특별자치도 강릉시 연곡면 진고개로 1687,37.8493532666684,128.72470617876,0507-1331-8762
에잇시즌스 카바나,강원특별자치도 홍천군 서면 팔봉산로 909-21,37.6901648139089,127.687506027095,
별바람 야영장,경남 밀양시 초동면 방동길 126,35.4514101258359,128.703933817523,
산속정원캠핑장,경기 연천군 전곡읍 양원로 346-61,37.9684017202273,127.038196139697,
청춘양구 소양호 뱃길 나루터,강원특별자치도 양구군 양구읍 소양호로 2522,38.0415043635168,127.968787886234,
밸리 버튼 Valley Butto ,강원특별자치도 양구군 방산면 평화로 5629,38.2259503895413,127.971514537047,
캠프그라운드 화우,경기 안성시 원곡면 천덕산로 857-2,37.0680770523029,127.173675274116,0507-1341-3109
캠프그라운드 성지,경기 안성시 원곡면 천덕산로 857-1,37.067443697591,127.173114983046,
하하호호 캠핑장,충북 청주시 상당구 가덕면 금거내암로 200,36.5677797100727,127.594570262623,
하루,충남 아산시 선장면 삼봉산길 28-7,36.7675100923177,126.884327696301,0507-1316-9151
웅포야영장,경북 울릉군 북면 현포2길 22,37.5265025771656,130.820342616416,
동글감나무캠핑장,전남 영암군 금정면 활성산길 21,34.8259933240698,126.745795594111,0507-1461-8785
캠핑노리,충남 공주시 정안면 느진묵길 91,36.5554286807012,127.081777482451,
유포리아 글램핑,경기 가평군 상면 축령로45번길 40-200,37.7705862581556,127.356372687878,
무지개글램핑,경기 가평군 북면 꽃넘이길 115-60,37.9000741015723,127.518116598146,
어도숲 캠핑장,경기 화성시 송산면 어섬길259번길 64,37.2446687502115,126.652457017192,
파주스(PAJUS),경기 파주시 탄현면 새오리로161번길 100-17,37.8011454668184,126.683395723598,
서해캠핑장,충남 보령시 천북면 하학로 740,36.4348563739399,126.502132043369,
벙커 캠핑,강원특별자치도 양양군 강현면 진미로 588-8,38.1124438124965,128.57477516059,
미로나라정원 글램핑장,강원특별자치도 삼척시 미로면 고내로 276,37.428475710804,129.06694786551,
강촌달머리캠핑장,강원 춘천시 서면 율장길 123-39,37.850929,127.5732255,010-8983-4040
원동자연휴양림,경상남도 양산시 원동면 내포리 산171 ,35.3977583,128.9389714,055-382-5839
은지가족야영장,경기 고양시 덕양구 흥도로 281-1 (도내동),37.6311820,126.8571360,031-965-5852
럭셔리글램핑라피네,경북 안동시 남후면 암산1길 18,36.5030261,128.6772366,0507-1324-3343
산디마을 생태공원 캠핑장,대전광역시 대덕구 장동 685-1 ,36.3969703,127.4385337,070-4158-3360
청양 동강리 오토캠핑장,충남 청양군 청남면 금강변로 868-135,36.3394000,126.9797750,041-940-2706
리아띠캠핑장,충북 제천시 봉양읍 국사봉로 287,37.1120099195619,128.11268084418,
월악산레트로캠핑N민박,충북 제천시 덕산면 월악산로5길 18-1,36.8831031,128.1503074,010-2665-4767
구시포 노을 캠핑장,전라북도 고창군 구시포안길 38,35.4421056,126.4347866,
어반파크 캠핑장&바베큐,경북 경주시 다불로 195-10 (용강동),35.8647898,129.235356,
큰마당 오토 캠핑장,충남 논산시 벌곡면 수락로 901-35,36.1955792,127.263510,
신두리 오렌지 캠핑장,충남 태안군 원북면 두웅로 356-123,36.8419916164755,126.197457924102,041-675-7727
웰니스,경남 고성군 삼산면 두포5길 193,34.9232109,128.2987845,
광덕그린농원 야영장,강원 화천군 사내면 검단길 213-31,38.1101225,127.4708715,010-4691-6813
람보 캠핑장,충북 제천시 금성면 청풍호로37길 25,37.0299961,128.180043,1522-3405-
오매기744,경기 의왕시 오매기백운산길 54-11 (오전동),37.3562916060931,126.998610976752,
너아라 캠핑장,인천 옹진군 영흥면 영흥서로 238,37.275360505385,126.477194233209,
임하호 수상레저타운캠핑장,경상북도 안동시 임동면 중평리 1040,36.5666883,128.9210806,054-822-1212
월현 포레스트,강원 횡성군 강림면 월안길 251,37.3696206,128.1780646,010-3044-0251
연곡해변 솔향기캠핑장,강원 강릉시 연곡면 해안로 1282-10,37.8588053,128.8533563,033-662-2900
서정카라반펜션,강원특별자치도 강릉시 사천면 해안로 938,37.8335750,128.8734160,0507-790-0879
미소가든펜션야영장,충북 제천시 봉양읍 옥전리 59-4번지,37.171724,128.1153075,
루파니애견캠핑장,충북 괴산군 감물면 감물로 362-54,36.8591986,127.8758459,010-3431-5879
개울가에캠핑관광농원,경기 포천시 신북면 청신로1196번길 112,37.9479305,127.1541668,
이안힐링랜드,충남 보령시 성주면 심원계곡로 334,36.3465930,126.677749,0507-1468-2520
서현농원 야영장,경기 의왕시 왕림길 85-1 (왕곡동),37.3427468,126.990357,
글램코티지,경북 영천시 임고면 포은로 175-32,35.9941656,128.9631484,054-927-0077
스테이123,강원특별자치도 강릉시 구정면 구정중앙로 155-8,37.7142387,128.8737650,
아빠의 캠프,경북 청도군 매전면 당호강변길 49-7,35.6694294,128.8635180,010-5334-5085
성동 서울숲 여름캠핑장(임시캠핑장),서울 성동구 뚝섬로 273 (성수동1가),37.5430701,127.0417991,
안면도마린오토캠핑장,충남 태안군 안면읍 방포항길 95,36.5051901,126.3347168,
팔공산국립공원 갓바위야영장,경북 경산시 와촌면 갓바위로 596,35.9858308,128.7486933,053-851-2225
포도길 캠핑장,경기 안성시 대덕면 신령로 255,37.0312621,127.224129,0507-1418-1931
봄이네 캠핑장,강원특별자치도 횡성군 서원면 옥계6길 25,37.4376362334469,127.853455535203,010-2200-0942
정담은 캠핑&글램핑,전남 장성군 북하면 남창로 407,35.4595089562915,126.840693256155,061-394-5535
화명 오토캠핑장,부산 북구 낙동강자전거길 1425 (덕천동),35.2179424,128.998423,051-337-2262
연화동권역 야영장,경상남도 의령군 낙서면 여의리 287-5 ,33.4915495,126.9071173,
쌍근오토캠핑장,경남 거제시 남부면 남부해안로 1054,34.7639995,128.5839805,010-2502-4115
대봉캠핑랜드,경남 함양군 병곡면 원산지소길 192,35.5881828,127.6790131,055-963-2026
렛 힐리스 아트캠핑,경남 산청군 금서면 동의보감로312번가길 141-70,35.4495279,127.851432,
비토어촌체험휴양마을,경남 사천시 서포면 거북길 447,34.9675224,127.9718060,055-852-7870
아빌라 더 오아시스,경남 사천시 해안관광로 68-20 (실안동),34.9479382,128.0411279,
용소유원지 야영장,경남 사천시 사남면 계양길 132,35.0143576,128.1334570,
시간의바깥,경남 남해군 이동면 보리암로 154,34.7745708,127.9757635,055-863-4666
보물섬 글램핑,경남 남해군 남해읍 선소로76번길 41-20,34.8455994,127.9112388,0507-1489-7756
해해해 캠핑장,경남 고성군 거류면 화당로 379,34.9804076,128.4405666,055-674-5780
대권오토야영캠핑장,경남 통영시 용남면 지도동부길 10-119,34.9182172,128.4740957,
합천해피캠핑,경남 합천군 대병면 서부로 2228,35.5343931,127.9998733,010-9310-6688
소나무 풍경 펜션 야영장,경남 창녕군 계성면 계성화왕산로 161,35.4903530,128.5264809,055-536-3889
좋은 카라반,경남 밀양시 삼랑진읍 행곡3길 65-34,35.4304607,128.9096784,1899-3790-
배티하우스,경남 합천군 쌍책면 황강옥전로 1062-50,35.6088000,128.2671014,
유곡면 농촌체험랜드,경남 의령군 유곡면 청정로 2278,35.4322552,128.3179136,
선바위야영장,강원 인제군 북면 미시령로 1796,38.2208245,128.4029221,
지리산 하루해 야영장,경남 하동군 악양면 악양서로 669-24,35.1896268,127.7171281,010-8539-2812
경호강 카라반,경남 산청군 단성면 호암로1320번길 88-4,35.3573671,127.9154486,010-2188-4287
지리산리조트 글램핑,경남 산청군 시천면 지리산대로511번길 11-33,35.2973379,127.7553318,010-5039-5002
용추글램핑&펜션,경남 함양군 안의면 용추계곡로 479,35.6733182,127.7736152,055-963-2255
아름빌,경남 양산시 원동면 어영로 204 ,35.4287102,128.934443,055-383-5566
엄마랑놀자키즈글램핑,경남 밀양시 초동면 초동중앙로 18,35.3867534,128.6707325,010-9461-9290
궁농오토캠핑장,경남 거제시 장목면 거제북로 2633-16,35.000663,128.7028142,010-8217-4977
의령 거장산 오토캠핑장,경남 의령군 궁류면 청정로5길 43-2,35.4375182,128.2596474,010-9649-0453
캠프라임,경남 양산시 원동면 원동로 1837-2,35.3919168,128.9211412,010-4621-8717
버드하우스 캠핑장,경남 남해군 창선면 서부로 1455-10,34.9186753,128.0211419,010-7298-8702
합천글램핑,경남 합천군 대병면 석장1길 61-15 (합천성은타운),35.5085760,128.0148684,055-931-6600
화왕산자연휴양림,경남 창녕군 고암면 청간길 128-126,35.5419122,128.5649672,055-533-2332
황매산 국민여가 캠핑장,경남 합천군 가회면 황매산공원길 331,35.4819189,128.0036224,055-932-5880
황산문화체육공원 국민여가캠핑장,경남 양산시 물금읍 황산공원5길 13,35.3017511,128.989598,055-379-8690
바람흔적 글램핑 앤 카라반,경남 합천군 가회면 대기1길 15-9,35.4596918,128.0049666,010-2045-3115
밀양아리랑 오토캠핑장,경상남도 밀양시 하남읍 명례리 1046-2,35.3545101,128.7593248,055-359-4636
지리산 벚꽃 카라반 캠핑장,경상남도 하동군 화개면 화개로 946-8 ,35.2628208,127.6367669,055-883-2606
통제영오토캠핑장,경상남도 통영시 한산면 한산일주로 171  한산도통제영테마마을,34.8005495,128.4745360,010-7259-8253
주은캠핑장,경상남도 거창군 북상면 덕유월성로 1642 ,35.7646898,127.7642655,
지리산백무동파크야영장,경남 함양군 마천면 가채길 15,35.3929733,127.6612496,010-3090-2131
천하마을야영장,경남 남해군 미조면 남해대로397번길 18,34.7243850,128.0136055,010-4619-3827
