name,address,lat,lon,phone
영천 구룡산 오토캠핑장,경북 영천시 북안면 상리중앙길 50-21,35.8532067,128.9893957,010-8866-8343
별하글램핑,충남 공주시 유구읍 구계연종길 108,36.5789883,126.9854872,
김삿갓계곡캠핑장,강원도 영월군 김삿갓면 김삿갓로 216-26 김삿갓계곡캠핑장,37.0795251,128.6022969,033-373-5558
숲스토리야영장,전북 진안군 정천면 봉학로 419-30,35.8891897,127.3947272,010-6538-8799
산우물 북 캠핑장,경기 안성시 양성면 산정산우물길 138,37.0819697,127.1958115,
캠프 인더숲,강원 홍천군 내촌면 가령폭포길 34,37.8248474,128.1548976,
별이빛나는밤에 글램핑,강원 영월군 무릉도원면 무릉법흥로 1090,37.3540972,128.2790521,010-8317-3824
두랭이해변 오토 캠핑장,전남 여수시 율촌면 두언길 106-51,34.8286759,127.5336159,
럭셔리풀빌라 글램핑 풀램핑,경기 가평군 청평면 남이터길 52-35,37.6894493,127.3726809,0507-1322-0249
웻 자켓,경기 포천시 이동면 늠바위길 201-3,38.0293388,127.3879245,0507-1493-0421
광양 해뜰 오토 캠핑장,전남 광양시 봉강면 신촌길 140,35.0629621,127.5536210,
반달곰이 살던 숲,경기 화성시 정남면 정송길23번길 18,37.1635651,126.9576251,
햇살아래 캠핑장,충청북도 충주시 대소원면 창현로 809 ,36.9229836,127.860459,010-5153-7331
캠핑중DOG,강원 홍천군 북방면 팔봉산로 1802,37.7204822,127.7524583,010-8768-1191
플로라 캠프,경남 의령군 낙서면 낙서로 553-13,35.4806945,128.3791190,
낭만팩토리,경기 평택시 안중읍 덕우리 115-30,37.0057297,126.9110960,010-3845-3478
오샤,경기 가평군 북면 소법리 627-54,37.8973678,127.5542861,
양평힐링계곡 오토캠핑장,경기 양평군 서종면 중미산로 772-27,37.6010371,127.4230682,031-772-9999
태안노을과바다캠핑앤글램핑,충남 태안군 원북면 신두해변길 122,36.8355206,126.1825790,
백운썬밸리캠핑장,충북 제천시 백운면 구학산로 600,37.1789641,127.9925747,010-6203-3303
자장캠핑장,경기 파주시 적성면 국사로 303,37.9611752,126.8692810,010-5151-7177
상사호 오토 캠핑장,전남 순천시 상사면 땅고개길 111,34.9394629,127.4620787,
가평더캠프카라반글램핑,경기 가평군 설악면 한서로156번길 12-62,37.6688396,127.5037181,0507-1309-3917
돔 아일랜드 304,경기 가평군 조종면 명지산로 137-56,37.8873231,127.3623971,031-584-0033
풀꽃이랑 캠핑장,경북 성주군 가천면 포천계곡로 238,35.8722271,128.1552055,0507-1488-2045
태양&바다 카라반,경북 포항시 남구 호미곶면 해맞이로 82,36.0714577,129.5689344,
숲 나들이 야영장,강원 횡성군 서원면 신평석화로 459,37.4421860,127.8493021,
잭슨글램핑,충북 충주시 금가면 김생로 1179,37.0405193,127.8665003,
아라캠프,강원 고성군 죽왕면 동해대로 6130-2,38.3462352,128.5113873,0507-1338-4756
법수치오토캠핑장,강원 양양군 현북면 법수치길 965,37.9100292,128.6180510,
캠플336캠핑장,전남 화순군 동복면 연동길 75,35.0419301,127.1154886,
칠갑산관광농원,충남 청양군 화성면 구숫골길 105-19,36.4356073,126.7257635,041-942-8110
빌리풀램핑,경기도 양평군 단월면 산음리 852-9 ,37.5928418,127.5851717,
스톤브룩 캠핑장,경기 연천군 군남면 진은로606번길 110,38.0441198,127.0575714,
옥당걸숲속관광농원,경북 김천시 부항면 안간1길 700,36.0055626,127.9559383,054-434-7773
벤캠프(Be  Camp),경기 포천시 영북면 산정호수로 834-12,38.0760751,127.3237208,
일영Star캠핑장,경기 양주시 장흥면 유원지로 406-144,37.7146682,126.9498966,
THE쉼오토캠핑장,충남 태안군 태안읍 안도내길 58-9,36.8132835,126.3285545,
가평다온캠핑장,경기 가평군 조종면 운악청계로 351-42,37.8463503,127.3536065,
루체른,경기 가평군 조종면 운악청계로333번길 19,37.8449803,127.3534311,
윈드밸리 야영장,강원 양양군 서면 구룡령로 1158,37.9144025,128.5012960,
이스트 몽 블루 카라반 캠핑,제주특별자치도 제주시 구좌읍 종달동길 73-1,33.4915495,126.9071173,064-783-7569
대양 야영장,경북 칠곡군 가산면 호국로 1252-21,36.0507939,128.4952388,054-972-4062
가나캠핑장,경북 경주시 내남면 안심길 357,35.7320462,129.1401446,010-3511-4487
캠핑 굄성,충남 홍성군 홍북읍 홍북로 810,36.6569912,126.7183498,
GO(지오)글램핑,충북 괴산군 청천면 대티길 284,36.6960025,127.8005961,0507-1427-0350
노섬브리아 야영장,강원 횡성군 둔내면 청태산로154번길 220-40,37.5087582,128.2575596,
비니비니글램핑,경기 포천시 내촌면 금강로 2625-37,37.8044709,127.2445513,010-2437-5018
하동노량투다리오토캠핑장,경남 하동군 금남면 노량해안길 129,34.9477998,127.8699072,0507-1306-0174
비토애 럭셔리글램핑 나주점,전남 나주시 산포면 산남로 67-47,35.0459985,126.8219644,
레이크202 캠핑장,경기 안성시 죽산면 용설호수길 202,37.0529475,127.4447534,0507-1320-7285
낭성 캠핑장,충북 청주시 상당구 낭성면 호정전하울길 99-50,36.6127895,127.6052664,
하늘아래 캠핑,충남 보령시 오천면 원산도6길 47-70,36.3650148,126.4182310,
스토리숲(story숲),경기 포천시 화현면 봉화로 201-80,37.8660745,127.2753721,
웰빙문화테마마을,경상북도 영덕군 남정면 남호리 296-1 ,36.3274290,129.3717950,054-730-6513
세제골농원 숲속야영장,충남 아산시 영인면 윤보선로 52-16,36.8822361,126.9985978,
가평 아이섬 풀 글램핑,경기 가평군 북면 꽃넘이길 115-115,37.8998714,127.5127458,
아인글램핑,경기 가평군 북면 제령아랫말길 67-30,37.8869977,127.5403662,02-2157-2844
안면도힐링캠핑장,충남 태안군 안면읍 갯개길 39,36.5501728,126.3345879,
다도해해상국립공원 구계등야영장,전남 완도군 완도읍 구계등길 47-1,34.2983381,126.7092746,061-550-0900
하늘숲 오토캠핑장,전북 완주군 동상면 대아수목로 439-2,35.9941126,127.3276265,
한솔 스테이,경기 연천군 장남면 장백로278번길 4,37.9853995,126.8864997,
더 코지 캠핑장,충남 논산시 노성면 노성로322번길 42-10,36.2779356,127.1036840,
일랑일랑 애견캠핑 앤 카라반,경북 칠곡군 왜관읍 강변대로 723,35.9426485,128.4020206,
이편한캠핑,강원 평창군 봉평면 흥정계곡4길 211,37.6608898,128.3109510,
경안글로브,경북 경주시 강동면 새마을로 1124-50,36.0517864,129.2574974,010-3837-7613
라곰,경기 연천군 신서면 합내로 493-1,38.1577398,127.0658856,0507-1312-5246
산가원글램핑,경남 산청군 금서면 쌍재로 117,35.4141119,127.8194656,0507-1312-9016
캠프위드펫&애견글램핑,경기 가평군 청평면 호명리길 57-60,37.7241632,127.4609008,031-584-5043
가보세캠핑장,경기 포천시 이동면 포화로 274-4,38.0737456,127.4143506,
메이드캠퍼스,경기 포천시 신북면 청신로1196번길 359-12,37.9331022,127.1658136,
홍성 캠프인코지 글램핑 카라반,충남 홍성군 서부면 홍보로 1316,36.5284795,126.4899021,
자유로캠핑장,경기 파주시 탄현면 자유로 3902-66,37.8291163,126.7207168,0507-1326-5017
(주)더술컴퍼니아카데미,서울 종로구 창경궁로 229 (명륜4가),37.5825402,126.9979229,
잭스캠프,경기 포천시 신북면 청신로1196번길 359-18,37.9329672,127.1662273,0507-1410-0928
타이니포춘,경기 포천시 신북면 청신로1196번길 359-17,37.9334444,127.1659957,0507-1337-0930
하소담캠핑장,경기 포천시 영중면 삼산마을길 20,38.0237775,127.2625021,0507-1433-9596
남이섬 마리나 카라반,강원 춘천시 남산면 북한강변길 142,37.8394502,127.5327943,033-264-5778
해밀365 야영장,경기 양평군 용문면 용문산로 576-12,37.5422071,127.5882184,031-772-6883
주식회사 대부도펜션시티,경기 안산시 단원구 공마루길 68-97 (대부동동),37.2340931,126.5892138,
디엠지라운지(DMZ LOUNGE),경기 파주시 탄현면 새오리로161번길 90,37.8004048,126.6835875,031-959-2353
어깨동무 카라반 캠핑,인천 강화군 길상면 동검길65번길 88-8,37.5883546,126.5185456,
호수도도글램핑장,전라남도 광양시 봉강면 지곡리 산 3-1 ,35.0002458,127.5934749,
서산버드랜드 야영장,충남 서산시 부석면 천수만로 655-73,36.6295138,126.3783232,
Moo 글램핑,경기 안산시 단원구 대부황금로 90 (선감동),37.1998281,126.6451584,0507-1480-8765
딥포레스트캠핑장,경기도 포천시 신북면 심곡리 704-3,37.9236539,127.1742228,
슈필라움글램핑,경기도 화성시 서신면 제부리 3-68,37.1740382,126.6270087,
재오개캠핑장,충북 충주시 살미면 충주호수로 1872,36.9509289,127.9813463,
용장 글램핑,경북 경주시 내남면 용장1길 18,35.7749306,129.2022859,
물왕호수캠핑,경기 시흥시 물왕수변로 178 (산현동),37.3786646,126.8415456,
월송리캠프,강원 춘천시 서면 월송길 381-21,37.9235042,127.6688754,
리버위드 글램핑,강원 춘천시 남면 박암관천길 899,37.7212947,127.5098162,
금동휴양림캠프2,경기 포천시 신북면 탑신로1112번길 7-40,37.9436828,127.1290861,
달리도 오토캠핑장,전남 목포시 달리길 329 (달동),34.7770717,126.3281211,
포레스트 캠핑장,충남 논산시 벌곡면 수락로 903-11,36.1962419,127.2629587,
까치고개,충남 천안시 동남구 수신면 장산서길 14-1,36.7301815,127.2973329,
숲속의쉼터 키즈,경기 연천군 전곡읍 양원로 318,37.9714390,127.0360446,
주암2123,울산 울주군 상북면 배내주암길 56-1,35.5680597,129.0187367,
홍천 뜨란 오토캠핑장,강원 홍천군 서면 개야마을길 144-10,37.6968083,127.6362740,
아이월관광농원,경기 포천시 창수면 한탄강1로 134-119,38.0556465,127.2092814,0507-1476-5587
로드 96 캠핑&카라반,전남 영광군 백수읍 해안로 672-31,35.3307461,126.3828791,0507-1340-2758
캠프달링,충남 공주시 정안면 개티길 20,36.6327707,127.0788538,010-4417-7777
관악산 계곡 캠핑장,서울특별시 관악구 신림동 205-1 관악산공원 내 ,37.4620698,126.9481674,
합천 머물당 글램핑,경남 합천군 가회면 황매산로 1070-6,35.4829619,128.0238690,
반딧불 캠핑장,경기 안성시 금광면 연내동길 138-37,36.9714608,127.3823246,
다올숲,경기 포천시 신북면 청신로1059번길 78-22,37.9607164,127.1438105,031-534-6712
우리고향 캠핑장,전남 곡성군 오곡면 섬진강로 2075-15,35.2651561,127.3326378,
햇골글램핑,경기 용인시 처인구 백옥대로1191번길 63-7 (유방동),37.2467383,127.2064444,
유성야영장 뱀브스힐,대전 유성구 갑동로15번길 32 (갑동),36.3623491,127.2868240,
해목글램핑,경기 가평군 조종면 운악청계로371번길 74-36,37.8532276,127.3489979,0507-1424-8245
더뷰인비토,경남 사천시 서포면 거북길 290,34.9709678,127.9651140,
오손도손캠핑장,충북 제천시 장자터길 17 (자작동),37.1231026,128.2860107,043-653-3331
라온캠프닉,경기 화성시 남양읍 송림로68번길 30-13,37.2208029,126.8261961,0507-1375-1399
에스원캠프,경기 포천시 영북면 대회산길 79-28,38.0669588,127.2383825,
더 플래츠 글램핑,경기 가평군 상면 수목원로 181-28,37.7622603,127.3645338,0507-1333-8008
도그팰리스 애견동반글램핑,충남 당진시 고대면 탕주막길 116-11,36.9752915,126.5426451,010-3533-5292
지투(G2) 캠핑장,경기 포천시 소흘읍 부흥로 370,37.8079803,127.1559589,031-541-0727
라구나캠프,경기 연천군 전곡읍 선사로 203-11,38.0101030,127.0690482,
포천 땡큐247 캠핑장,경기 포천시 신북면 청신로 1240,37.9532504,127.1524255,
테라스527 캠핑장,경기 포천시 영북면 산정호수로 529,38.0571123,127.3217751,
달그린캠프,경기 연천군 미산면 청정로771번길 113-257,38.0523882,126.9431204,
가평 구름산 카라반,경기 가평군 상면 수목원로 238-81,37.7573547,127.3579710,010-4501-2277
지금쉬다,경기 가평군 조종면 연인산로 453,37.8467359,127.3729656,010-3447-7473
우디안캠핑,경기 가평군 가평읍 태봉두밀로406번길 93-17,37.8218531,127.4541370,
일루 글램핑 스파,경기 가평군 북면 멱골로 116-6,37.9007892,127.5683107,
캠핑가는 날,경남 김해시 인제로 436 (삼방동),35.2670743,128.8957684,
바다랑 캠핑장,경남 통영시 용남면 원평길 916,34.9099682,128.4440710,
더 상상 글램핑,경기 가평군 가평읍 경반안로 357-5,37.8313781,127.4699249,
(주)구들택 겨울숲 지점,경기 가평군 설악면 봉미산안길13번길 176-51,37.6301797,127.5361730,
태양힐링숲,경기 파주시 적성면 설마천로 372,37.9467693,126.9415457,
평화누리체험장,경기 연천군 장남면 원당로87번길 34,37.9810263,126.8836625,
소설악 가족 캠핑장,경기 광주시 남한산성면 남한산성로 407,37.4605232,127.2124415,
캠핑온유,울산 울주군 삼동면 보삼길 134-1,35.4875384,129.1171908,
산달바다 캠핑장,경남 거제시 거제면 거제남서로 4091,34.8352047,128.5440850,055-632-6644
(주)드윌,경상남도 함안군 산인면 모곡리 809-4 ,35.2806678,128.4514642,
한탄강 카누 캠핑장,경기 연천군 전곡읍 선사로 270,38.0133697,127.0758112,
별보다글램핑,경남 합천군 가회면 황매산로 1060,35.4826548,128.0233297,
485캠핑장,경기 가평군 설악면 다락재로485번길 162-69,37.6491169,127.4508378,
알프스펜션 캠핑&글램핑,경기 가평군 설악면 어비산길 24,37.5989515,127.4949341,
북두칠성,경기 가평군 가평읍 태봉두밀로 493-24,37.8133765,127.4480165,
캠프99,경기 가평군 조종면 명지산로 327-131,37.9012897,127.3692762,031-584-9599
JIAN,경기 가평군 설악면 유명산길 31,37.5986275,127.4930571,031-585-8511
휴 오토 캠핑장,경기 가평군 상면 녹수계곡로 125,37.7742312,127.3939722,
달별캠핑,경기 양평군 양동면 고송길 32-12,37.4862336,127.6996429,
아르테오스 빌리지,경기 용인시 처인구 이동읍 백자로260번길 6-2,37.2018971,127.1756001,
현대야영장,경남 합천군 용주면 합천호반로 613,35.5591898,128.0458768,
스테이온디엣지,경기 가평군 청평면 남이터길 52-35,37.6894493,127.3726809,
지리산 가는길 903 캠핑장,경남 함양군 휴천면 지리산가는길 903-3,35.4650670,127.6976066,
화왕산오토캠핑장,경남 창녕군 계성면 계성화왕산로 235,35.4934736,128.5328649,055-521-2001
블루밍 캠핑장,경기 포천시 신북면 청신로 1046-1,37.9561221,127.1360710,070-4159-0933
인디언숲 캠프닉,경기 동두천시 천보산로 537 (탑동동),37.8797108,127.0976424,031-865-2466
고라니 오토캠핑장,강원 고성군 토성면 신평골길 29-1,38.2301706,128.5066759,070-8098-7231
여울카라반,경기 포천시 이동면 여우고개로 658,38.0482848,127.3775787,
포도밸리 캠핑장,경기 가평군 상면 임초밤안골로 83,37.7620205,127.3729465,
울미숲야영장,경기 포천시 군내면 꽃배산2길 73,37.8635216,127.2319768,031-536-9070
도그랜드 캠핑장,경기 가평군 조종면 운악청계로 238-84,37.8355250,127.3559449,
신박힐링캠프,경남 하동군 적량면 삼화실로 759,35.1385259,127.7586309,055-884-0558
헤이캠프클럽,울산 울주군 서생면 잿골길 72,35.3684247,129.3486329,052-239-3388
캠핑플레이,경기 가평군 북면 논남기길 468-33,37.9686787,127.4157684,
홀리데이캠핑파크,경기 안산시 단원구 서위매봉길 14 (대부북동),37.2842002,126.5685955,032-885-4461
가평캠핑장,경기 가평군 상면 임초밤안골로 205,37.7521716,127.3680093,
레저빌봉산,경남 합천군 봉산면 서부로 4344-11,35.6277091,128.0443549,
반딧불이,강원 영월군 무릉도원면 황정길 165-9,37.2982221,128.1443930,
캠프원,경기 포천시 이동면 새낭로 621-13,38.0321686,127.3263447,
슈가스파글램핑,경기 가평군 북면 가화로 1422-14,37.9003800,127.5110176,
엣더몬,경기 가평군 상면 원흥길 52-127,37.8202538,127.3222053,
우니메이카 강화점,인천 강화군 하점면 창후로228번길 26-16,37.7691141,126.3641106,010-2380-1189
잣숲캠핑장,경기 포천시 신북면 지동길 114-13,37.9379521,127.1205729,031-535-5399
파인벨리펜션 글램핑,경기 포천시 화현면 봉화로 315-97,37.8750647,127.2740640,
여우하우야영장,경기 시흥시 하우로94번길 39 (대야동),37.4632034,126.7878976,
히든캠프,경기 안성시 죽산면 용설호수길 170-1,37.0553303,127.4472319,
신불산 베이스캠프 오토캠핑장,울산 울주군 삼남읍 자수정로 125,35.5381194,129.0976705,
캠핑가는 날,경남 밀양시 산내면 얼음골로 134-48,35.5794765,128.9812267,
아우어캄푸스,경기 양평군 청운면 신론로 360,37.5606254,127.7752245,
한천관광농원야영장,전남 화순군 한천면 죽헌로 376-34,34.9739417,127.0098302,
용바위야영장,전라남도 곡성군 목사동면 구룡리 293 ,35.1366774,127.3137391,
하동하늘숲캠핑장,경남 하동군 청암면 안양로 118,35.1637549,127.8060107,
홍스랜드 글램핑,제주특별자치도 제주시 애월읍 어음13길 25-45,33.4029030,126.3472261,
안성 별숲 캠핑장,경기 안성시 죽산면 곰내미길 11,37.0101674,127.4244674,
따봄,경기 하남시 서하남로576번길 119 (교산동),37.5186743,127.2063617,
유명산밸리 캠핑장,경기 가평군 설악면 유명로 626,37.6021815,127.4935246,
나아정,경기 가평군 상면 축령로 183-102,37.7723317,127.3527468,
숲속에 머물다,강원 춘천시 서면 툇골길 349,37.9360606,127.6675007,
캠프 오어즈,강원 영월군 무릉도원면 백년계곡길 116,37.3746937,128.2718472,
엉클킴스 캠핑장,경기 포천시 신북면 탑신로 940,37.9336603,127.1406908,
곡성달빛 야영장,전남 곡성군 죽곡면 남양마을1길 239-5,35.1875396,127.3412483,
리틀 포레스트 캠핑,경기 가평군 상면 임초밤안골로 230,37.7510684,127.3663017,
유명산 258,경기 가평군 설악면 유명산길 61-12,37.5964304,127.4922293,
둥근돌캠핑장,경기 양평군 양동면 몰운고갯길 732-9,37.4920834,127.7418036,010-8631-5435
청계호수 자작나무숲 캠핑장,경기 포천시 일동면 운악청계로1480번길 22,37.9382538,127.3397259,
주원캠핑장,경기 용인시 처인구 원삼면 보개원삼로1415번길 11-14,37.1206426,127.3074110,
리버앤캠프,경기 연천군 청산면 백궁길 27,38.0260281,127.1369629,
한산도 충무공교실 야영장,경남 통영시 한산면 한산일주로 622,34.7807499,128.5010068,055-647-0708
썬오브글램핑,경기 포천시 이동면 금강로6263번길 14-2,38.0880425,127.3897429,
양평온누리캠핑장,경기 양평군 서종면 갈문길 29-1,37.6472432,127.4336580,
두부삼촌캠프,경기 파주시 파평면 청송로652번길 44,37.9406758,126.8803426,
아린 글램핑,경기 가평군 설악면 유명로 2150-14,37.6985680,127.4597874,
반가운캠핑장,경상남도 거제시 동부면 구천리 647-8,34.7980689,128.6272159,055-637-4747
지맨 카라반파크,경기 안양시 만안구 예술공원로 213 (석수동),37.4205599,126.9291516,031-473-8800
호노골 캠핑장,경남 진주시 지수면 용봉로 561,35.2504886,128.2272471,
오롯하다 키즈글램핑 가평,경기 가평군 북면 가화로 1364-55,37.9020740,127.5137764,
옥천1382,경남 창녕군 창녕읍 전평길 15-807,35.4946002,128.5486027,
까치산 체험관광농원,경기 용인시 처인구 모현읍 초부로54번길 40,37.3099413,127.2456067,
달사랑 캠핑장,경기 포천시 신북면 아트밸리로 196,37.9235414,127.2343096,010-9240-9560
어썸캠핑장,인천 강화군 화도면 마니산로 808-11,37.6336404,126.4084801,032-937-1580
철원포레스트,강원 철원군 갈말읍 순담길 69,38.1710191,127.3012336,
매향 오토 캠핑장,경기 화성시 우정읍 궁평항로 81-22,37.0527371,126.7592065,
우리오토캠핑장,경기 연천군 연천읍 동내로 304,38.0891730,127.1116051,
트멍 캠핑장,경기 포천시 소흘읍 광릉수목원로 932-2,37.7794961,127.1415921,
호랑이캠핑,경기 포천시 영북면 새낭로 919,38.0556940,127.3251217,
캠프627,경남 산청군 단성면 호암로1320번길 90-31,35.3550812,127.9176326,
더파인캠핑,경기 포천시 소흘읍 죽엽산로 515,37.7884288,127.1660184,
초리풍경,경기 파주시 법원읍 초리골길 180,37.8538897,126.8914930,031-958-0164
오블리비아테,경기 가평군 가평읍 당목가일길 410-68,37.8661486,127.5565451,
윤 오토캠핑장,경기 양평군 청운면 비룡1길 49-19,37.5451490,127.6988015,031-775-5229
강변글램핑,경기 김포시 금포로 1202 (운양동),37.6516116,126.7008778,010-2872-9584
카사비앙카,강원 삼척시 근덕면 부남해변길 15,37.3586101,129.2503816,
이숲e랜드 야영장,전남 장성군 북하면 병풍로 782-11,35.3253017,126.8693491,061-395-8388
라라플레이스,강원도 양양군 현북면 하광정리 608-6 ,38.023764846219564,128.72009165750654,
폴라데이 캠핑장,경기 포천시 군내면 선정비로 58,37.8870540,127.2155059,031-535-5001
남해 힐링국민여가캠핑장,경남 남해군 이동면 성남로 105,34.7786958,127.9499272,055-862-2227
스칼라캠프장,강원 춘천시 남산면 추곡고개길 326-121,37.7651221,127.6476322,
가평 리오카라반,경기 가평군 상면 축령로70번길 44-61,37.7794989,127.3629559,
라온힐야영장,경기 가평군 상면 수목원로 224,37.7585268,127.3610824,
해밀터,충북 괴산군 청천면 이평4길 23-14,36.6634019,127.8688233,
산마루카라반,경기 포천시 이동면 화동로1724번길 124-14,37.9952108,127.3747122,
위더스글램핑,경남 창녕군 남지읍 박진로 627,35.4259846,128.4043502,
우니메이카 당진점,충남 당진시 고대면 온동로 1-21,36.9595439,126.5506463,1688-3972-
호미곶 고래마을 캠핑장,경북 포항시 남구 호미곶면 고래마을길 8,36.0322311,129.5775102,
그자리 야영장,강원 홍천군 서면 노일로 478,37.6952997,127.7238698,033-433-1580
우니메이카 안동점,경북 안동시 남후면 무릉1길 20-46,36.5205595,128.6756395,
우니메이카 밀양점,경남 밀양시 단장면 국전로 78-5,35.5087379,128.8753088,
하늘빛,인천 옹진군 영흥면 영흥서로 527-26,37.2744568,126.4536388,010-2496-6796
르쏠레이475카페 야영장,강원 양구군 양구읍 박수근로365번길 84-11,38.1054957,127.9727437,
경상북도교육청김천오토캠핑장	,경북 김천시 증산면 증산1로 163,35.9097778,128.0254889,054-434-5255
호두마루글램핑,경남 사천시 서포면 선창부두길 11-2,34.9910550,127.9742009,
관광농원금산만악리수목원오토캠핑장,충남 금산군 진산면 초미동길 138-10,36.1547058,127.4371752,041-752-5525
그린앤블루,경남 밀양시 단장면 고례로 805-25,35.4894615,128.9234833,055-351-2200
카라반파크 아마존,전북 완주군 구이면 항가리 1203,35.7194782,127.1088124,063-279-9282
밀양 도깨비방망이 캠핑장,경남 밀양시 단장면 단장로 1055,35.4859449,128.8497855,055-355-1300
명덕농원,경기 포천시 화현면 봉화로 400-134,37.8862519,127.2852868,031-531-5651
종이섬 야영장,경남 통영시 용남면 지도해안로 303,34.9143563,128.4724198,
교육가족체험장,충남 부여군 세도면 인세로 40-3,36.1670413,126.9726951,041-832-1996
김천실내테니스장 & 김천오토캠핑장,경북 김천시 남면 초곡길 287-97,36.1407786,128.1779613,054-432-9000
김천맑은계곡 오토캠핑장,경북 김천시 부항면 대야길 307,36.0192538,127.9184282,054-433-1832
화순돔아일랜드,전남 화순군 화순읍 학포로 2653-20,35.0462361,126.9612612,061-373-4556
라라캠핑장,경남 양산시 원동면 원동로 1899-30,35.3959128,128.9242567,
선장포협동조합,충남 아산시 선장면 선장로 121-10,36.7903534,126.8595945,070-7797-0104
더존 관광농원,경기 포천시 이동면 화동로2076번길 125,38.0327484,127.3803955,010-8883-8902
물바람캠핑장,전북 완주군 동상면 송광수만로 1079-61,35.9291573,127.2641587,
을왕리 솔트 캠핑장,인천 중구 용유서로423번길 38 (을왕동),37.4576530,126.3689413,033-751-9300
(주)백동소풍가는길,경남 양산시 백동길 128 (소주동),35.4037221,129.1443610,055-389-0127
오아시스정글,강원 인제군 인제읍 필례약수길 84-10,38.0762331,128.3690179,033-463-0901
별밤 글램핑,경기도 가평군 상면 원흥리 514-13,37.82130459998124,127.32096795765152,
글램인스타,강원도 정선군 고한읍 고토일길 210-15,37.2186396,128.8585657,
둥그레휴양마을,충북 보은군 보은읍 강신1길 3,36.5003063,127.7480850,043-544-5735
캠프 고토일,강원 평창군 봉평면 흥정계곡3길 60,37.648236953685156,128.32869532961703,
마을야영장  침산추월,세종특별자치시 조치원읍 침산6길 13,36.6004221,127.2937900,070-7777-8649
정선 도원펜션&캠핑장,강원 정선군 북평면 어도원길 165,37.4392957,128.6255169,033-563-0548
캠프여주,경기 여주시 북내면 중암2길 19-22,37.3571279,127.7102973,010-9252-8762
메기의 추억,경기 가평군 조종면 연인산로 296,37.8378812,127.3660601,
아름다운 농원,경기 포천시 영북면 북원로 281,38.1223184,127.2682375,031-531-8281
(가)꽃향기,충남 부여군 은산면 충절로2883번길 13,36.3131271,126.8457645,
자연과힐링,강원 횡성군 청일면 봉덕로299번길 65,37.5756095,128.1834990,033-342-4888
카캠 그라운드,경기 가평군 조종면 세곡로 155,37.8341998,127.3315589,
